[
  {
    "id": "sitting-office-work",
    "name_zh": "辦公室坐姿工作",
    "name_en": "Sitting, office work",
    "category": "daily-activity",
    "met_value": 1.3,
    "intensity": "sedentary",
    "kcal_per_hour_60kg": 78,
    "kcal_per_hour_70kg": 91,
    "kcal_30min_60kg": 39,
    "taiwan_context": "台灣上班族平均每日坐姿工作 8–10 小時。長時間久坐的健康風險獨立於運動量（即使有規律運動，久坐仍有害）",
    "source": "Ainsworth BE et al. (2011). 2011 Compendium of Physical Activities.",
    "_meta": { "last_updated": "2026-04-07" }
  },
  {
    "id": "standing-working",
    "name_zh": "站立工作",
    "name_en": "Standing, working",
    "category": "daily-activity",
    "met_value": 1.8,
    "intensity": "sedentary",
    "kcal_per_hour_60kg": 108,
    "kcal_per_hour_70kg": 126,
    "kcal_30min_60kg": 54,
    "taiwan_context": "站立辦公桌（standing desk）在台灣漸普及。與久坐相比，每日 4 小時站立可多消耗約 120 kcal",
    "source": "Ainsworth BE et al. (2011). 2011 Compendium of Physical Activities.",
    "_meta": { "last_updated": "2026-04-07" }
  },
  {
    "id": "walking-commute",
    "name_zh": "通勤步行（捷運站 / 公車站往返）",
    "name_en": "Walking, commuting",
    "category": "daily-activity",
    "met_value": 3.0,
    "intensity": "light",
    "kcal_per_hour_60kg": 180,
    "kcal_per_hour_70kg": 210,
    "kcal_30min_60kg": 90,
    "taiwan_context": "台北捷運的平均步行距離約 600m，約 8–10 分鐘。每日上下班步行（來回）約 20 分鐘，消耗約 60 kcal（60kg）",
    "source": "Ainsworth BE et al. (2011). 2011 Compendium of Physical Activities.",
    "_meta": { "last_updated": "2026-04-07" }
  },
  {
    "id": "scooter-riding",
    "name_zh": "騎機車（通勤）",
    "name_en": "Riding scooter / motorcycle",
    "category": "daily-activity",
    "met_value": 2.5,
    "intensity": "light",
    "kcal_per_hour_60kg": 150,
    "kcal_per_hour_70kg": 175,
    "kcal_30min_60kg": 75,
    "taiwan_context": "台灣機車密度全球最高，大多數上班族以機車通勤。騎機車屬輕度活動（主要為靜態姿勢維持），不計入「有效運動量」",
    "source": "Ainsworth BE et al. (2011). 2011 Compendium of Physical Activities.",
    "_meta": { "last_updated": "2026-04-07" }
  },
  {
    "id": "cooking-meal-prep",
    "name_zh": "烹飪 / 備餐",
    "name_en": "Cooking, meal preparation",
    "category": "daily-activity",
    "met_value": 2.0,
    "intensity": "light",
    "kcal_per_hour_60kg": 120,
    "kcal_per_hour_70kg": 140,
    "kcal_30min_60kg": 60,
    "taiwan_context": "台灣外食比例高，但自煮者仍普遍（特別是晚餐）。台式料理備餐（洗菜切菜、炒菜）強度略高於西式",
    "source": "Ainsworth BE et al. (2011). 2011 Compendium of Physical Activities.",
    "_meta": { "last_updated": "2026-04-07" }
  },
  {
    "id": "household-cleaning",
    "name_zh": "打掃家務（拖地、吸塵）",
    "name_en": "Household cleaning, mopping, vacuuming",
    "category": "daily-activity",
    "met_value": 3.5,
    "intensity": "moderate",
    "kcal_per_hour_60kg": 210,
    "kcal_per_hour_70kg": 245,
    "kcal_30min_60kg": 105,
    "taiwan_context": "積極打掃（拖地 + 吸塵 + 擦拭）可達到中強度活動標準，是被低估的運動量來源",
    "source": "Ainsworth BE et al. (2011). 2011 Compendium of Physical Activities.",
    "_meta": { "last_updated": "2026-04-07" }
  },
  {
    "id": "sleeping",
    "name_zh": "睡眠",
    "name_en": "Sleeping",
    "category": "daily-activity",
    "met_value": 0.95,
    "intensity": "sedentary",
    "kcal_per_hour_60kg": 57,
    "kcal_per_hour_70kg": 67,
    "kcal_30min_60kg": 29,
    "taiwan_context": "睡眠的 MET（0.95）略低於靜坐（1.0），但睡眠品質對代謝率影響極大。睡眠不足（< 6 小時）會降低基礎代謝率並增加飢餓素（ghrelin）分泌",
    "source": "Ainsworth BE et al. (2011). 2011 Compendium of Physical Activities.",
    "_meta": { "last_updated": "2026-04-07" }
  }
]
