[
  {
    "id": "walking-slow-4kmh",
    "name_zh": "慢走（4 km/hr）",
    "name_en": "Walking, slow, 4 km/hr",
    "category": "aerobic",
    "met_value": 2.8,
    "intensity": "light",
    "kcal_per_hour_60kg": 168,
    "kcal_per_hour_70kg": 196,
    "kcal_30min_60kg": 84,
    "met_code": "17010",
    "taiwan_context": "台灣常見的日常散步速度，適合作為入門有氧活動。衛福部建議每日步行目標 6,000–10,000 步",
    "source": "Ainsworth BE et al. (2011). 2011 Compendium of Physical Activities. Med Sci Sports Exerc 43(8):1575–1581.",
    "_meta": { "last_updated": "2026-04-07" }
  },
  {
    "id": "walking-brisk-6kmh",
    "name_zh": "快走（6 km/hr）",
    "name_en": "Walking, brisk, 6 km/hr",
    "category": "aerobic",
    "met_value": 3.5,
    "intensity": "moderate",
    "kcal_per_hour_60kg": 210,
    "kcal_per_hour_70kg": 245,
    "kcal_30min_60kg": 105,
    "met_code": "17151",
    "taiwan_context": "衛福部建議的「中等強度」有氧活動標準之一，以「微喘但仍能說話」為判斷依據",
    "source": "Ainsworth BE et al. (2011). 2011 Compendium of Physical Activities.",
    "_meta": { "last_updated": "2026-04-07" }
  },
  {
    "id": "jogging-8kmh",
    "name_zh": "慢跑（8 km/hr）",
    "name_en": "Jogging, 8 km/hr",
    "category": "aerobic",
    "met_value": 8.3,
    "intensity": "vigorous",
    "kcal_per_hour_60kg": 498,
    "kcal_per_hour_70kg": 581,
    "kcal_30min_60kg": 249,
    "met_code": "12050",
    "taiwan_context": "台灣常見跑步速度（配速約 7'30\"），適合 5km 訓練。大安森林公園、河濱公園跑者的主流速度",
    "source": "Ainsworth BE et al. (2011). 2011 Compendium of Physical Activities.",
    "_meta": { "last_updated": "2026-04-07" }
  },
  {
    "id": "running-10kmh",
    "name_zh": "跑步（10 km/hr）",
    "name_en": "Running, 10 km/hr",
    "category": "aerobic",
    "met_value": 9.8,
    "intensity": "vigorous",
    "kcal_per_hour_60kg": 588,
    "kcal_per_hour_70kg": 686,
    "kcal_30min_60kg": 294,
    "met_code": "12060",
    "taiwan_context": "配速約 6'00\"，有跑步基礎者常用速度。台灣路跑賽事（萬金石、台北馬拉松）的一般完賽速度",
    "source": "Ainsworth BE et al. (2011). 2011 Compendium of Physical Activities.",
    "_meta": { "last_updated": "2026-04-07" }
  },
  {
    "id": "running-12kmh",
    "name_zh": "跑步（12 km/hr）",
    "name_en": "Running, 12 km/hr",
    "category": "aerobic",
    "met_value": 11.5,
    "intensity": "very-vigorous",
    "kcal_per_hour_60kg": 690,
    "kcal_per_hour_70kg": 805,
    "kcal_30min_60kg": 345,
    "met_code": "12065",
    "taiwan_context": "配速 5'00\"，進階跑者速度",
    "source": "Ainsworth BE et al. (2011). 2011 Compendium of Physical Activities.",
    "_meta": { "last_updated": "2026-04-07" }
  },
  {
    "id": "cycling-indoor-flywheel-moderate",
    "name_zh": "飛輪（室內有氧騎車，中強度）",
    "name_en": "Indoor cycling / Spin class, moderate",
    "category": "aerobic",
    "met_value": 8.5,
    "intensity": "vigorous",
    "kcal_per_hour_60kg": 510,
    "kcal_per_hour_70kg": 595,
    "kcal_30min_60kg": 255,
    "taiwan_context": "台灣健身房最熱門的團體課程之一，通常 45–60 分鐘一堂。45 分鐘課程 60kg 成人約消耗 383 kcal",
    "source": "Ainsworth BE et al. (2011). 2011 Compendium of Physical Activities.",
    "notes": "飛輪課強度差異大，教練帶領的高強度課程 MET 可達 10–12",
    "_meta": { "last_updated": "2026-04-07" }
  },
  {
    "id": "cycling-outdoor-moderate-15kmh",
    "name_zh": "戶外騎自行車（15 km/hr，休閒）",
    "name_en": "Cycling outdoor, leisure, 15 km/hr",
    "category": "aerobic",
    "met_value": 5.8,
    "intensity": "moderate",
    "kcal_per_hour_60kg": 348,
    "kcal_per_hour_70kg": 406,
    "kcal_30min_60kg": 174,
    "met_code": "01009",
    "taiwan_context": "台灣常見的腳踏車通勤 / 河濱公園休閒騎乘速度",
    "source": "Ainsworth BE et al. (2011). 2011 Compendium of Physical Activities.",
    "_meta": { "last_updated": "2026-04-07" }
  },
  {
    "id": "cycling-outdoor-vigorous-25kmh",
    "name_zh": "戶外騎自行車（25 km/hr，快速）",
    "name_en": "Cycling outdoor, vigorous, 25 km/hr",
    "category": "aerobic",
    "met_value": 10.0,
    "intensity": "vigorous",
    "kcal_per_hour_60kg": 600,
    "kcal_per_hour_70kg": 700,
    "kcal_30min_60kg": 300,
    "met_code": "01015",
    "taiwan_context": "公路車騎士的一般訓練速度，台灣北宜公路、武嶺登頂等",
    "source": "Ainsworth BE et al. (2011). 2011 Compendium of Physical Activities.",
    "_meta": { "last_updated": "2026-04-07" }
  },
  {
    "id": "swimming-freestyle-moderate",
    "name_zh": "游泳（自由式，中等速度）",
    "name_en": "Swimming, freestyle, moderate pace",
    "category": "aerobic",
    "met_value": 5.8,
    "intensity": "moderate",
    "kcal_per_hour_60kg": 348,
    "kcal_per_hour_70kg": 406,
    "kcal_30min_60kg": 174,
    "met_code": "18310",
    "taiwan_context": "台灣公共游泳池費用低廉，且全年皆可游泳。對膝關節不適者是理想的低衝擊有氧運動",
    "source": "Ainsworth BE et al. (2011). 2011 Compendium of Physical Activities.",
    "_meta": { "last_updated": "2026-04-07" }
  },
  {
    "id": "jump-rope",
    "name_zh": "跳繩",
    "name_en": "Jump rope / skipping",
    "category": "aerobic",
    "met_value": 12.3,
    "intensity": "very-vigorous",
    "kcal_per_hour_60kg": 738,
    "kcal_per_hour_70kg": 861,
    "kcal_30min_60kg": 369,
    "met_code": "11580",
    "taiwan_context": "台灣學校體育課常見項目，不需器材空間小，是高效率熱量消耗選項。30 分鐘消耗熱量接近跑步 45 分鐘",
    "source": "Ainsworth BE et al. (2011). 2011 Compendium of Physical Activities.",
    "notes": "初學者容易因踝關節負擔過大而受傷，建議循序漸進",
    "_meta": { "last_updated": "2026-04-07" }
  },
  {
    "id": "hiit-moderate",
    "name_zh": "HIIT（高強度間歇訓練，中等難度）",
    "name_en": "HIIT, moderate difficulty",
    "category": "aerobic",
    "met_value": 8.0,
    "intensity": "vigorous",
    "kcal_per_hour_60kg": 480,
    "kcal_per_hour_70kg": 560,
    "kcal_30min_60kg": 240,
    "taiwan_context": "20 分鐘 HIIT 的實際消耗約 160 kcal（60kg），但運動後「後燃效應」（EPOC）可額外增加 50–100 kcal。台灣健身房和 YouTube 教學課程普及",
    "source": "Ainsworth BE et al. (2011). 2011 Compendium of Physical Activities；Tabata I et al. (1996). Effects of moderate-intensity and high-intensity intermittent training. Med Sci Sports Exerc.",
    "_meta": { "last_updated": "2026-04-07" }
  },
  {
    "id": "stair-climbing",
    "name_zh": "爬樓梯（快速上下）",
    "name_en": "Stair climbing, fast",
    "category": "aerobic",
    "met_value": 8.8,
    "intensity": "vigorous",
    "kcal_per_hour_60kg": 528,
    "kcal_per_hour_70kg": 616,
    "kcal_30min_60kg": 264,
    "met_code": "17145",
    "taiwan_context": "台灣公寓樓梯、辦公大樓都是爬樓梯的好機會。每爬一層樓約消耗 1–2 kcal（60kg），10 層樓快速來回約 15–20 kcal",
    "source": "Ainsworth BE et al. (2011). 2011 Compendium of Physical Activities.",
    "_meta": { "last_updated": "2026-04-07" }
  }
]
